{
  "schema_version": "1.0",
  "camera_id": "cam01",
  "view_id": "exit-view-v1",
  "reference_frame": {"width": 1280, "height": 720},
  "max_observation_gap_ms": 1000,
  "live_stale_after_ms": 2000,
  "zones": [
    {
      "zone_id": "east_exit",
      "hazard_type": "blocked_exit",
      "polygon": [[0.3, 0.55], [0.8, 0.55], [0.8, 0.95], [0.3, 0.95]],
      "candidate_labels": ["chair", "backpack", "suitcase"],
      "min_confidence": 0.35,
      "footprint_height_fraction": 0.2,
      "enter_overlap": 0.3,
      "exit_overlap": 0.15,
      "person_occlusion_ratio": 0.2,
      "confirm_ms": 5000,
      "candidate_clear_ms": 1000,
      "resolve_ms": 3000
    }
  ]
}
